{
  "payload_version": "v1",
  "source": "hacker_news",
  "source_item_id": "finance.yahoo.com_news_openai-exec-becomes-top-trump-230342268.html",
  "title": "OpenAI exec becomes top Trump donor with $25M gift",
  "canonical_url": "https://finance.yahoo.com/news/openai-exec-becomes-top-trump-230342268.html",
  "published_at": "2026-02-08T08:00:00Z",
  "source_domain": "finance.yahoo.com",
  "source_metadata": {
    "hn_score": 19,
    "hn_comments": 7,
    "collection": "ai_news",
    "job_name": "fetch_ai_news",
    "job_run_id": "backfill_2026-02-08_hacker_news-013",
    "scraped_at": "2026-02-08T08:00:00Z",
    "scrape_run_uuid": "5c0af97f-5c44-5684-88a2-c23f8e2bfc86",
    "item_uuid": "093722b1-2545-50a6-864e-39b2b15a390d"
  }
}
