{
  "payload_version": "v1",
  "source": "arxiv",
  "source_item_id": "arxiv.org_abs_2602.10074v1",
  "title": "CAPID: Context-Aware PII Detection for Question-Answering Systems",
  "canonical_url": "http://arxiv.org/abs/2602.10074v1",
  "published_at": "2026-02-11T08:00:00Z",
  "source_domain": "arxiv.org",
  "source_metadata": {
    "collection": "ai_news",
    "job_name": "fetch_ai_news",
    "job_run_id": "backfill_2026-02-11_arxiv-071",
    "scraped_at": "2026-02-11T08:00:00Z",
    "scrape_run_uuid": "f9b8f6c2-84b0-52f8-b350-bca500039052",
    "item_uuid": "97912d86-387a-5929-85be-e735e79dff9e"
  },
  "body_text": "[cs.CR, cs.CL] Detecting personally identifiable information (PII) in user queries is critical for ensuring privacy in question-answering systems. Current approaches mainly redact all PII, disregardin"
}
