{
  "payload_version": "v1",
  "source": "hacker_news",
  "source_item_id": "news.ycombinator.com_item",
  "title": "Launch HN: Omnara (YC S25) â€“ Run Claude Code and Codex from anywhere",
  "canonical_url": "https://news.ycombinator.com/item?id=46991591",
  "published_at": "2026-02-13T08:00:00Z",
  "source_domain": "news.ycombinator.com",
  "source_metadata": {
    "hn_score": 113,
    "hn_comments": 134,
    "collection": "ai_news",
    "job_name": "fetch_ai_news",
    "job_run_id": "backfill_2026-02-13_hacker_news-012",
    "scraped_at": "2026-02-13T08:00:00Z",
    "scrape_run_uuid": "34a74daf-03ac-56c4-b9ad-2fdcf6010f30",
    "item_uuid": "8ef41ed2-8808-5b64-8878-59113df81627"
  }
}
