{
  "payload_version": "v1",
  "source": "deepmind_blog",
  "source_item_id": "deepmind.google_blog_veo-3-1-ingredients-to-video-more-consistency-creativity-and-control",
  "title": "Veo 3.1 Ingredients to Video: More consistency, creativity and control",
  "canonical_url": "https://deepmind.google/blog/veo-3-1-ingredients-to-video-more-consistency-creativity-and-control/",
  "published_at": "2026-02-12T08:00:00Z",
  "source_domain": "deepmind.google",
  "source_metadata": {
    "collection": "ai_news",
    "job_name": "fetch_ai_news",
    "job_run_id": "backfill_2026-02-12_deepmind_blog-019",
    "scraped_at": "2026-02-12T08:00:00Z",
    "scrape_run_uuid": "2ef688ef-8547-5a9b-a018-9a615119d729",
    "item_uuid": "624f6b42-ee28-5600-b813-c7235752a97e"
  },
  "body_text": "Our latest Veo update generates lively, dynamic clips that feel natural and engaging â€” and supports vertical video generation."
}
