{
  "payload_version": "v1",
  "source": "dedup_ai-news",
  "source_item_id": "openai.com_index_bringing-chatgpt-to-genaimil",
  "title": "OpenAI deploys ChatGPT on GenAI.mil for US defense",
  "source_metadata": {
    "collection": "ai_news",
    "job_name": "fetch_ai_news",
    "job_run_id": "backfill_2026-02-14_dedup-009",
    "scraped_at": "2026-02-14T08:00:00Z",
    "scrape_run_uuid": "ed115544-2839-56f8-a01c-093a1799f612",
    "item_uuid": "8d713ad9-d649-51ab-a0da-51245937d3c2"
  },
  "canonical_url": "https://openai.com/index/bringing-chatgpt-to-genaimil",
  "source_domain": "openai.com",
  "body_text": "Custom ChatGPT deployed on US military's AI platform.",
  "published_at": "2026-02-14T08:00:00Z"
}
