{
  "payload_version": "v1",
  "source": "techcrunch_ai",
  "source_item_id": "techcrunch.com_2026_02_07_new-york-lawmakers-propose-a-three-year-pause-on-new-data-centers",
  "title": "New York lawmakers propose a three-year pause on new data centers",
  "canonical_url": "https://techcrunch.com/2026/02/07/new-york-lawmakers-propose-a-three-year-pause-on-new-data-centers/",
  "published_at": "2026-02-09T08:00:00Z",
  "source_domain": "techcrunch.com",
  "source_metadata": {
    "collection": "ai_news",
    "job_name": "fetch_ai_news",
    "job_run_id": "backfill_2026-02-09_techcrunch_ai-049",
    "scraped_at": "2026-02-09T08:00:00Z",
    "scrape_run_uuid": "a5f6ae28-f92f-5794-8e2e-f47f38d07530",
    "item_uuid": "568bbee9-163f-5a71-b6f9-493461552143"
  },
  "body_text": "Although the billâ€™s prospects are uncertain, New York is at least the sixth state to consider pausing construction of new data centers."
}
