{
  "payload_version": "v1",
  "source": "dedup_china-news",
  "source_item_id": "www.scmp.com_news_china_article_3343545_brazil-breaks-china-linked-us190m-money-laundering-ring-tied-top-crime-syndicate",
  "title": "Brazil breaks up China-linked $190m money-laundering ring",
  "source_metadata": {
    "collection": "china_news",
    "job_name": "fetch_china_news",
    "job_run_id": "backfill_2026-02-14_dedup-040",
    "scraped_at": "2026-02-14T08:00:00Z",
    "scrape_run_uuid": "16210395-ab9d-5e6c-b132-37b4a9a957c9",
    "item_uuid": "321a79f4-230a-575a-931c-77c9ecc59c93"
  },
  "canonical_url": "https://www.scmp.com/news/china/article/3343545/brazil-breaks-china-linked-us190m-money-laundering-ring-tied-top-crime-syndicate",
  "source_domain": "www.scmp.com",
  "body_text": "Chinese-run distribution network accused of laundering drug proceeds in Brazil.",
  "published_at": "2026-02-14T08:00:00Z"
}
