{
  "payload_version": "v1",
  "source": "simon_willison",
  "source_item_id": "simonwillison.net_2026_Feb_11_manosphere-report",
  "title": "Quoting Andrew Deck for Niemen Lab",
  "canonical_url": "https://simonwillison.net/2026/Feb/11/manosphere-report/#atom-everything",
  "published_at": "2026-02-13T08:00:00Z",
  "source_domain": "simonwillison.net",
  "source_metadata": {
    "collection": "ai_news",
    "job_name": "fetch_ai_news",
    "job_run_id": "backfill_2026-02-13_simon_willison-037",
    "scraped_at": "2026-02-13T08:00:00Z",
    "scrape_run_uuid": "34a74daf-03ac-56c4-b9ad-2fdcf6010f30",
    "item_uuid": "6199b3d3-59e7-5cd9-94b2-70a5850ceed9"
  },
  "body_text": "An AI-generated report, delivered directly to the email inboxes of journalists, was an essential tool in the Timesâ€™ coverage. It was also one of the first signals that conservative media was turning a"
}
