{
  "payload_version": "v1",
  "source": "hacker_news",
  "source_item_id": "arstechnica.com_tech-policy_2026_02_victory-for-elon-musk-us-labor-board-abandons-authority-over-spacex",
  "title": "US labels SpaceX a common carrier by air, will regulate firm under railway law",
  "canonical_url": "https://arstechnica.com/tech-policy/2026/02/victory-for-elon-musk-us-labor-board-abandons-authority-over-spacex/",
  "published_at": "2026-02-12T08:00:00Z",
  "source_domain": "arstechnica.com",
  "source_metadata": {
    "hn_score": 130,
    "hn_comments": 53,
    "collection": "ai_news",
    "job_name": "fetch_ai_news",
    "job_run_id": "backfill_2026-02-12_hacker_news-009",
    "scraped_at": "2026-02-12T08:00:00Z",
    "scrape_run_uuid": "2ef688ef-8547-5a9b-a018-9a615119d729",
    "item_uuid": "d804f34b-1f94-58d2-8358-2373de000a64"
  }
}
