{
  "payload_version": "v1",
  "source": "hacker_news",
  "source_item_id": "www.fda.gov_news-events_press-announcements_fda-intends-take-action-against-non-fda-approved-glp-1-drugs",
  "title": "FDA intends to take action against non-FDA-approved GLP-1 drugs",
  "canonical_url": "https://www.fda.gov/news-events/press-announcements/fda-intends-take-action-against-non-fda-approved-glp-1-drugs",
  "published_at": "2026-02-08T08:00:00Z",
  "source_domain": "www.fda.gov",
  "source_metadata": {
    "hn_score": 129,
    "hn_comments": 264,
    "collection": "ai_news",
    "job_name": "fetch_ai_news",
    "job_run_id": "backfill_2026-02-08_hacker_news-005",
    "scraped_at": "2026-02-08T08:00:00Z",
    "scrape_run_uuid": "5c0af97f-5c44-5684-88a2-c23f8e2bfc86",
    "item_uuid": "796087cf-c7cb-54bb-a2f0-dac4192668d5"
  }
}
